{
  "$schema": "https://json-schema.org/draft/2020-12/schema",
  "$id": "https://lattice.slidewright.dev/manifest.schema.json",
  "title": "Lattice component manifest",
  "description": "Spec + prose source-of-truth for a Lattice layout. The engine reads name/function/form/substance/skeleton/slots/variants. The build-component-docs.js generator reads the prose fields (description, purpose, whenToUse, antiPatterns, related, variantDocs) to emit <name>.docs.md and <name>.gallery.md. See design/design-system.md.",
  "type": "object",
  "required": ["name", "function", "form", "substance", "description", "skeleton"],
  "additionalProperties": false,
  "properties": {
    "$schema": {
      "type": "string"
    },
    "name": {
      "type": "string",
      "pattern": "^[a-z][a-z0-9-]*$",
      "description": "The `_class` directive value (kebab-case)."
    },
    "function": {
      "enum": ["anchor", "statement", "inventory", "comparison", "progression", "evidence", "imagery"],
      "description": "Audience-function family the component belongs to (what the viewer leaves knowing). One of the seven taxonomies in design/design-system.md §3."
    },
    "bucket": {
      "enum": ["anchor", "statement", "inventory", "comparison", "progression", "evidence", "imagery", "chart", "diagram", "math", "code", "legal"],
      "description": "Disk-layout bucket the component lives in under lib/components/<bucket>/<name>/. Defaults to the value of `function` when absent. Four substance-defined buckets (`chart` for data visualizations, `diagram` for topological visuals, `math` for typeset equations, `code` for syntax-highlighted source) and one domain-defined bucket (`legal` for legal-family components) override the function value when colocation aids maintenance — each substance bucket describes a category of rendered content, not the library that happens to render it today. See design/design-system.md §9."
    },
    "galleryAuthored": {
      "type": "boolean",
      "description": "When true, the build-component-docs.js generator skips writing <name>.gallery.md (the file is hand-authored). Use this for components where variation lives in slide CONTENT, not in modifier classes — e.g. `diagram` (every Mermaid diagram type is the same _class) or future `code`/`math` if their galleries need a richer showcase than the manifest's variantDocs can express. <name>.docs.md is still generated from the manifest. The integration test continues to assert light/dark page-count parity for the PDFs but no longer derives the expected count from the manifest formula."
    },
    "form": {
      "enum": ["bookend", "divider", "canvas", "grid", "stack", "ledger", "panel", "matrix", "scatter", "timeline", "split"]
    },
    "substance": {
      "enum": ["prose", "structure", "series", "graph", "mixed"]
    },
    "description": {
      "type": "string",
      "minLength": 1,
      "description": "One-sentence human description."
    },
    "purpose": {
      "type": "string",
      "minLength": 1,
      "description": "Optional: 2-3 sentence rationale for when to reach for this component."
    },
    "variants": {
      "type": "array",
      "items": {
        "type": "string",
        "pattern": "^[a-z][a-z0-9-]*$"
      },
      "description": "Layout-specific modifier names. MUST NOT include universal or semi-universal variants — those are added automatically by effectiveVariants()."
    },
    "excludes": {
      "type": "array",
      "items": {
        "type": "string"
      },
      "description": "Semi-universal variants this layout opts out of (must be a subset of compact / loose / accent)."
    },
    "slots": {
      "type": "object",
      "additionalProperties": {
        "type": "object",
        "required": ["selector", "description"],
        "properties": {
          "selector": { "type": "string", "minLength": 1 },
          "required": { "type": "boolean" },
          "description": { "type": "string", "minLength": 1 }
        }
      }
    },
    "skeleton": {
      "type": "string",
      "minLength": 1,
      "description": "Markdown emitted by the scaffolder. Must include the `_class` directive."
    },
    "docs": {
      "type": "string",
      "description": "Deprecated: deep link into a reference doc. Superseded by the generated <name>.docs.md sibling."
    },
    "example": {
      "type": "string",
      "description": "Deprecated: relative path to a snippet file. Superseded by <name>.gallery.md."
    },
    "whenToUse": {
      "type": "array",
      "description": "Bulleted authoring guidance. Each entry has a short title + body sentence. Renders as the 'When to use' section of <name>.docs.md and as the opening prose slide of <name>.gallery.md.",
      "items": {
        "type": "object",
        "required": ["title", "body"],
        "additionalProperties": false,
        "properties": {
          "title": { "type": "string", "minLength": 1 },
          "body": { "type": "string", "minLength": 1 }
        }
      }
    },
    "antiPatterns": {
      "type": "array",
      "description": "'Don't' callouts. Same {title, body} shape as whenToUse so the cards-grid meta-slide in the gallery renders consistent bold-title cards. Renders as the 'When NOT to use' section of <name>.docs.md and the anti-patterns slide of <name>.gallery.md.",
      "items": {
        "type": "object",
        "required": ["title", "body"],
        "additionalProperties": false,
        "properties": {
          "title": { "type": "string", "minLength": 1 },
          "body": { "type": "string", "minLength": 1 }
        }
      }
    },
    "related": {
      "type": "array",
      "description": "See-also pointers to other components.",
      "items": {
        "type": "object",
        "required": ["name", "when"],
        "additionalProperties": false,
        "properties": {
          "name": { "type": "string" },
          "when": { "type": "string" }
        }
      }
    },
    "sample": {
      "type": "string",
      "minLength": 1,
      "description": "Full slide markdown (including the `_class` directive line, with no modifier) for the default-appearance slide of <name>.gallery.md. The skeleton field is the placeholder template for the scaffolder; sample is real prose that demonstrates the component."
    },
    "stressSample": {
      "type": "string",
      "minLength": 1,
      "description": "Optional. Full slide markdown for an extra <name>.gallery.md slide that stress-tests the engine with an edge-case input (high volume, wide value range, long text) past the tidy default sample. Rendered after the variant slides; counted by expectedGallerySlideCount()."
    },
    "variantDocs": {
      "type": "object",
      "description": "Per-variant prose used by the generator. Keys MUST be a subset of variants[]; the validator enforces this.",
      "additionalProperties": {
        "type": "object",
        "required": ["caption", "sample"],
        "additionalProperties": false,
        "properties": {
          "label": { "type": "string", "minLength": 1 },
          "caption": { "type": "string", "minLength": 1, "description": "One-sentence summary of what the variant does." },
          "sample": { "type": "string", "minLength": 1, "description": "Full slide markdown (including the `_class` directive line) demonstrating this variant in context." }
        }
      }
    },
    "anatomyBlock": {
      "type": "string",
      "pattern": "^[a-zA-Z][a-zA-Z0-9-]*$",
      "description": "ID into the canonical ASCII catalog at tools/ascii-preview.py (e.g. \"T7-card-grid-2x2\" or \"divider-bookend\"). The generator resolves this against `python3 tools/ascii-preview.py build` so geometry stays uniform across all components and the canonical block can never drift."
    },
    "showcase": {
      "type": "object",
      "additionalProperties": false,
      "description": "Opt-in metadata for the docs LANDING page (docs/src/pages/index.astro) and its showcase image pipeline (docs/scripts/rasterize-showcase.mjs). Independent of the component portal, which already lists every component automatically. Flagging a component here pulls it into the curated landing highlight reel on the next build (run `npm run showcase` once to rasterize its image).",
      "properties": {
        "featured": {
          "type": "boolean",
          "description": "Include this component as a tile in the landing 'every kind of slide' showcase strip."
        },
        "hero": {
          "type": "boolean",
          "description": "Use this component as the landing hero — its `sample` is shown as the headline source and rendered as the hero slide. Exactly one component should set this."
        },
        "page": {
          "type": "integer",
          "minimum": 1,
          "description": "1-based gallery-PDF page to rasterize for the showcase image. Defaults to 2, the manifest `sample` slide."
        }
      }
    }
  }
}
