{
  "name": "principles",
  "function": "inventory",
  "form": "stack",
  "substance": "structure",
  "description": "Declared statements — short stated principles, each with a one-line justification.",
  "purpose": "Use for design tenets, working agreements, or guiding rules. Each principle reads as a complete sentence; the justification is below.",
  "variants": [
    "numbered"
  ],
  "slots": {
    "title": {
      "selector": "h2",
      "required": true,
      "description": "Slide heading."
    },
    "principles": {
      "selector": "ul > li",
      "required": true,
      "description": "One li per principle. Lead each with **The principle.** then a justification sentence."
    }
  },
  "skeleton": "<!-- _class: principles -->\n\n## How we make calls when the spec is silent.\n\n- **Bias to action.** Default to shipping a defensible answer over chasing a perfect one.\n- **Decisions over options.** Document the choice, not the menu we evaluated.\n- **Cheaper to reverse than to debate.** Reversible calls don't need a meeting.\n",
  "anatomyBlock": "principles",
  "docs": "docs/references/templates.md#principles-declared-statements"
}
