{
  "name": "matrix-2x2",
  "function": "comparison",
  "form": "matrix",
  "substance": "structure",
  "description": "Static 2×2 quadrant grid with author-placed items per cell.",
  "purpose": "Use for categorical 2×2 reasoning when the items are fixed and you control which cell each lands in. For data-plotted scatter on continuous axes, use quadrant instead.",
  "variants": ["dark"],
  "slots": {
    "title": { "selector": "h2", "required": true, "description": "Slide heading naming the framework." },
    "axes": { "selector": "ul > li", "required": true, "description": "Four outer list items (one per cell). Lead each with **Quadrant label.** then the items as inner bullets." }
  },
  "skeleton": "<!-- _class: matrix-2x2 -->\n\n## Where each option lives.\n\n- **High value · Low cost.**\n  - First item in this quadrant\n  - Second item\n- **High value · High cost.**\n  - First item in this quadrant\n- **Low value · Low cost.**\n  - First item in this quadrant\n- **Low value · High cost.**\n  - First item in this quadrant\n",
  "docs": "docs/references/templates.md#matrix-2x2-quadrant-grid"
}
