{
  "$schema": "../manifest.schema.json",
  "name": "regulatory-update",
  "function": "progression",
  "form": "ledger",
  "substance": "structure",
  "description": "Change log against a baseline — numbered list of statutes/cases/rules with citation, summary, and effective date.",
  "purpose": "Use when a quarter's regulatory motion needs a single-slide digest. Each row carries the change name, the citation (inline code), the summary, and the effective-date marker (inline code).",
  "variants": [
    "timeline",
    "priority"
  ],
  "slots": {
    "heading": {
      "selector": "h2",
      "required": true,
      "description": "Slide heading framing the period or theme of the changes."
    },
    "scope": {
      "selector": "p:first-of-type > code",
      "required": false,
      "description": "Optional inline-code scope label (e.g. 'Federal · State · International')."
    },
    "items": {
      "selector": "ol > li",
      "required": true,
      "description": "Ordered list of changes. Each item leads with a plain text name; nested ul carries citation (code), summary, and effective date (code)."
    }
  },
  "skeleton": "<!-- _class: regulatory-update -->\n\n## Headline naming the period or theme.\n\n`Scope label · jurisdiction tier`\n\n1. Change name\n   - `Citation reference`\n   - Summary in one sentence.\n   - `Effective Mon YYYY`\n2. Change name\n   - `Citation reference`\n   - Summary in one sentence.\n   - `Effective Mon YYYY`\n3. Change name\n   - `Citation reference`\n   - Summary in one sentence.\n   - `Effective Mon YYYY`\n",
  "anatomyBlock": "regulatory-update",
  "sample": "<!-- _class: regulatory-update -->\n\n## Privacy and AI motion — Q1 2026.\n\n`Federal · State · International`\n\n1. EU AI Act\n   - `Title III`\n   - Conformity-assessment pre-market obligation took effect.\n   - `Effective Feb 2026`\n2. Colorado AI Act\n   - `SB 24-205`\n   - Developer and deployer duties for consequential-decision systems.\n   - `Effective Feb 2026`\n3. FTC v. Avast\n   - `§5 unfairness`\n   - $16.5M consent order; clarifies the deception standard for privacy branding.\n   - `Final Mar 2026`\n4. Texas DPSA\n   - `§541.151`\n   - DSAR opt-out portal mandatory; small-business safe-harbor narrowed.\n   - `Effective Mar 2026`\n",
  "whenToUse": [
    {
      "title": "Period-bounded digest",
      "body": "When a quarter or half of regulatory motion needs to land as a single scannable ledger. The audience sees what moved, when it took effect, and where to read it — without flipping through a multi-page memo."
    },
    {
      "title": "Citation is the proof",
      "body": "Each row anchors on its inline-code citation chip. Without the citation the row reads as opinion; with it, the row earns its place in a compliance brief."
    },
    {
      "title": "Effective-date pill closes the row",
      "body": "The trailing `Effective Mon YYYY` chip tells the audience whether the change is live, imminent, or final. The pill is the row's call-to-action signal."
    }
  ],
  "antiPatterns": [
    {
      "title": "Single rule's lineage",
      "body": "If the slide walks one rule from statute through case, use `authority-chain`. regulatory-update is a period digest."
    },
    {
      "title": "Past six rows",
      "body": "More than six items compresses the row gap and the citation chips run out of room. Split by jurisdiction."
    },
    {
      "title": "Missing summary or citation",
      "body": "Each row needs all three sub-items — citation, summary, effective date. Otherwise the row reads as rumour."
    }
  ],
  "related": [
    {
      "name": "authority-chain",
      "when": "single rule walked statute → regulation → guidance → case"
    },
    {
      "name": "list-criteria",
      "when": "flat enumeration of requirements without dates or citations"
    },
    {
      "name": "timeline",
      "when": "chronological sequence of events on a single axis"
    },
    {
      "name": "list-tabular",
      "when": "structured metadata per row but no regulatory framing"
    }
  ],
  "variantDocs": {
    "timeline": {
      "label": "Timeline — chronological spine instead of ranked ledger",
      "caption": "Renders the rows as a chronological spine — effective-date chips align on the right and the chrome reads as a calendar rather than a ranking. Use when chronology is the read, not weight.",
      "sample": "<!-- _class: regulatory-update timeline -->\n\n## Privacy and AI motion — Q1 2026 by effective date.\n\n`Federal · State · International`\n\n1. EU AI Act\n   - `Title III`\n   - Conformity-assessment pre-market obligation took effect.\n   - `Effective Feb 2026`\n2. Colorado AI Act\n   - `SB 24-205`\n   - Developer and deployer duties for consequential-decision systems.\n   - `Effective Feb 2026`\n3. FTC v. Avast\n   - `§5 unfairness`\n   - $16.5M consent order; clarifies the deception standard for privacy branding.\n   - `Final Mar 2026`\n4. Texas DPSA\n   - `§541.151`\n   - DSAR opt-out portal mandatory; small-business safe-harbor narrowed.\n   - `Effective Mar 2026`\n"
    },
    "priority": {
      "label": "Priority — ranked by exposure rather than chronology",
      "caption": "Stamps a priority rail on the left of each row and ranks by exposure rather than effective date. Use for board updates where the audience needs 'what to do' before 'when it landed'.",
      "sample": "<!-- _class: regulatory-update priority -->\n\n## Q1 motion ranked by exposure.\n\n`Top three · by ARR at risk`\n\n1. EU AI Act\n   - `Title III`\n   - High-risk system inventory due before April.\n   - `Effective Feb 2026`\n2. Colorado AI Act\n   - `SB 24-205`\n   - Deployer disclosures required; copy in flight.\n   - `Effective Feb 2026`\n3. Texas DPSA\n   - `§541.151`\n   - DSAR opt-out portal mandatory.\n   - `Effective Mar 2026`\n"
    }
  }
}
