{
  "$schema": "../manifest.schema.json",
  "name": "split-brief",
  "function": "statement",
  "form": "split",
  "substance": "structure",
  "description": "Executive brief — dark left anchor, findings list on the right with left-rule chrome.",
  "purpose": "Use when one paragraph of executive context needs to read alongside three or four substantiating findings. The dark left panel is the anchor; the right panel is the evidence.",
  "slots": {
    "eyebrow": {
      "selector": "p:first-of-type > code",
      "required": false,
      "description": "Optional inline-code eyebrow above the heading."
    },
    "heading": {
      "selector": "h2",
      "required": true,
      "description": "Heading shown in the dark left anchor."
    },
    "lede": {
      "selector": "p",
      "required": true,
      "description": "One-sentence framing paragraph under the heading."
    },
    "findings": {
      "selector": "ul > li",
      "required": true,
      "description": "Right-side findings. Lead each with **Title.** then nested body lines."
    }
  },
  "skeleton": "<!-- _class: split-brief -->\n\n`Eyebrow context`\n\n## Headline that anchors the brief.\n\nOne-sentence framing paragraph explaining what the findings cover.\n\n- **First finding.** Supporting detail explaining the first finding.\n- **Second finding.** Supporting detail explaining the second finding.\n- **Third finding.** Supporting detail explaining the third finding.\n",
  "anatomyBlock": "split-brief",
  "sample": "<!-- _class: split-brief -->\n\n`Q2 Performance Review`\n\n## Enterprise revenue stalled in Q2.\n\nThree structural factors explain 90% of the shortfall — all addressable before Q4 close.\n\n- **Renewal pricing complexity is driving churn at the segment ceiling.**\n  - Four accounts totaling $2.1M ARR declined renewal. Win/loss interviews point to a quote-to-contract gap, not value perception.\n- **Pipeline conversion dropped 11 pp below Q1 — legal review is the chokepoint.**\n  - Contract length increased 18 days on average. Root cause is a security addendum introduced in March.\n- **Competitive displacement accelerated in the $80-200K ACV tier.**\n  - Seven losses to a single competitor. Time-to-value gap is the exposure.\n",
  "whenToUse": [
    {
      "title": "Executive context + findings",
      "body": "When the slide needs both a paragraph of framing AND a list of substantiating points. The dark left panel carries the framing; the right list carries the evidence. Pure list (no framing) belongs in `list` or `cards-stack`."
    },
    {
      "title": "Three to four findings",
      "body": "Sweet spot is 3-4 findings. Fewer wastes the layout's grid; more crowds the right panel and the audience loses scannability."
    },
    {
      "title": "Executive audiences",
      "body": "The brief shape mirrors how analysts and execs structure memos: thesis on the left, evidence on the right. Reach for split-brief when the deck reads like a memo, not a presentation."
    }
  ],
  "antiPatterns": [
    {
      "title": "More than 5 findings",
      "body": "Past 5 findings, the right panel becomes a wall of bullets and the layout's balance breaks. Split into two slides or use `cards-stack` for a fuller list."
    },
    {
      "title": "Lede that's not a sentence",
      "body": "The lede is the framing. A fragment or eyebrow-style phrase wastes the role. Write one declarative sentence that sets up why the findings matter."
    },
    {
      "title": "Findings without titles",
      "body": "The **Title.** at the start of each li is what makes the right panel scannable. A naked sentence per bullet reads as paragraph soup; the bold lead is the structure."
    }
  ],
  "related": [
    {
      "name": "split-panel",
      "when": "the right side is a list of supporting points, not findings"
    },
    {
      "name": "split-statement",
      "when": "the left side carries a quote, not a thesis"
    },
    {
      "name": "cards-stack",
      "when": "the slide is mostly the list of findings; no executive framing needed"
    },
    {
      "name": "tldr",
      "when": "5+ one-line takeaways without supporting detail"
    }
  ]
}
