{
  "$schema": "../../manifest.schema.json",
  "name": "split-list",
  "function": "statement",
  "form": "panel",
  "substance": "structure",
  "description": "Featured left panel + supporting list on the right.",
  "purpose": "Use when one prominent statement deserves a dark sidebar and the right side carries the substantiating points.",
  "variants": [
    "mirror"
  ],
  "slots": {
    "panel-heading": {
      "selector": "h2",
      "required": true,
      "description": "Heading shown in the dark left panel."
    },
    "panel-eyebrow": {
      "selector": "h3",
      "required": false,
      "description": "Optional rubric label below the panel heading."
    },
    "points": {
      "selector": "ul > li",
      "required": true,
      "description": "Right-side supporting points. Lead each with **Label.** then body text."
    }
  },
  "skeleton": "<!-- _class: split-list -->\n\n## Panel headline that frames the side points.\n\n### Section rubric\n\n- First point\n  - Supporting sentence explaining the first point.\n- Second point\n  - Supporting sentence explaining the second point.\n- Third point\n  - Supporting sentence explaining the third point.\n",
  "anatomyBlock": "T17-split-list",
  "sample": "<!-- _class: split-list -->\n\n## A featured statement on the left lands the argument.\n\n### Use when\n\n- One claim deserves emphasis\n  - The panel headline carries the weight; the right side substantiates.\n- You need both a thesis and proof\n  - Statement on the left, evidence list on the right.\n- The right side is short\n  - Three to four supporting points; longer lists belong in cards-stack.\n- The mirror modifier flips it\n  - Image-style decks often want the panel on the right.\n",
  "whenToUse": [
    {
      "title": "Thesis plus proof",
      "body": "One bold claim deserves dedicated visual weight on the left; supporting points sit to the right. Use when the audience needs to hear the claim before the evidence."
    },
    {
      "title": "Section openers with substance",
      "body": "More substantive than a divider, but still anchored by a single statement. Three to four supporting points keep the panel from feeling cluttered."
    },
    {
      "title": "Mirror for image-heavy decks",
      "body": "The `mirror` variant flips the panel to the right. Useful when the deck's visual rhythm wants accents on alternating sides."
    }
  ],
  "antiPatterns": [
    {
      "title": "Longer than four points",
      "body": "If the right side runs past four points, the panel and list lose balance. Move to `cards-stack` for longer lists or split into two slides."
    },
    {
      "title": "No panel headline",
      "body": "The dark panel exists to carry a statement. An empty or generic heading wastes the strongest visual real estate on the slide."
    },
    {
      "title": "Stacking many split-list slides in a row",
      "body": "The dark sidebar is a strong visual signal. Three split-list slides back-to-back numbs the audience to it. Intersperse with content or stats."
    }
  ],
  "related": [
    {
      "name": "split-statement",
      "when": "thesis + one big-number — quantitative version of split-list"
    },
    {
      "name": "split-brief",
      "when": "title-style left + executive paragraph right"
    },
    {
      "name": "big-number",
      "when": "single statement, no supporting list — the full-canvas version"
    },
    {
      "name": "cards-stack",
      "when": "the right-side list grows past four points"
    }
  ],
  "variantDocs": {
    "mirror": {
      "label": "Mirror — panel on the right",
      "caption": "Flips the dark accent panel from the left to the right. Use when the deck's visual rhythm wants alternating accent sides, or when the right-to-left reading flow suits the claim.",
      "sample": "<!-- _class: split-list mirror -->\n\n## And the same claim, now with the panel on the right.\n\n### Use when\n\n- Decks with image slides\n  - Image bleed sits left; the panel reads as a closing statement on the right.\n- Alternating visual rhythm\n  - Pair a default split-list and a mirrored one across a section to keep the eye moving.\n- Right-to-left framing\n  - The argument reads more naturally when the claim follows the evidence rather than preceding it.\n"
    }
  }
}
