{
  "name": "compare-prose",
  "function": "comparison",
  "form": "split",
  "substance": "structure",
  "description": "Two prose options side-by-side with a labeled corner tag on each.",
  "purpose": "Use to weigh two approaches against each other in body text. Add the `chosen` or `decision` modifier to mark the verdict; add `vertical` to stack top/bottom instead of side-by-side.",
  "variants": ["compact", "dark", "mirror", "chosen", "decision", "vertical"],
  "slots": {
    "title": { "selector": "h2", "required": true, "description": "Slide heading framing the comparison." },
    "options": { "selector": "ul > li", "required": true, "description": "Exactly two list items, each one option. Lead each with **Option label.** then 1–3 sentences." }
  },
  "skeleton": "<!-- _class: compare-prose -->\n\n## Heading framing the comparison.\n\n- **First option.** Two-sentence description of the first option, including the strongest argument for it.\n- **Second option.** Two-sentence description of the second option, including the strongest argument for it.\n",
  "docs": "docs/references/templates.md#template-11-comparison-side-by-side-with-connector"
}
