{
  "$schema": "../../manifest.schema.json",
  "name": "subtopic",
  "function": "anchor",
  "form": "divider",
  "substance": "prose",
  "description": "Sub-section boundary — lighter than divider, no canvas reskin.",
  "purpose": "Introduces a specific topic within a section. Use between divider and content slides for finer orientation. Same light canvas as content slides, centered heading, no special background — a lighter cousin to the dark divider.",
  "variants": [
    "numbered"
  ],
  "slots": {
    "heading": {
      "selector": "h2",
      "required": true,
      "description": "Sub-topic name."
    },
    "eyebrow": {
      "selector": "p > code",
      "required": false,
      "description": "Optional eyebrow label above h2."
    }
  },
  "skeleton": "<!-- _class: subtopic -->\n\n`Topic family`\n\n## Sub-topic name.\n",
  "anatomyBlock": "subtopic-bookend",
  "sample": "<!-- _class: subtopic -->\n\n`Anchor family · light divider`\n\n## Subtopic introduces a specific topic within a section.\n",
  "whenToUse": [
    {
      "title": "Between divider and content",
      "body": "After the dark divider opens a section, a subtopic narrows the focus to one specific topic before the audience hits the first content slide. Finer-grained orientation."
    },
    {
      "title": "Lighter than divider",
      "body": "Same bright canvas as body slides — keeps the visual rhythm intact while still signaling a topic shift. Lighter context-switch cost than a divider."
    },
    {
      "title": "Eyebrow names the topic family",
      "body": "The inline-code paragraph above the heading is the breadcrumb. \"Section 02 · Module 03\" tells the audience exactly where they are in the deck's hierarchy."
    }
  ],
  "antiPatterns": [
    {
      "title": "Used as a divider replacement",
      "body": "If the next slides are an entirely new section, reach for divider (dark canvas, h1). Subtopic is for sub-section orientation, not section starts."
    },
    {
      "title": "Stacked subtopics",
      "body": "Two subtopic slides back-to-back means the first didn't introduce anything. Merge them or move directly to content."
    },
    {
      "title": "h1 instead of h2",
      "body": "The layout expects h2 (subtopic name is one level below the section title). Promoting to h1 makes the slide compete visually with the divider."
    }
  ],
  "related": [
    {
      "name": "divider",
      "when": "major section starts — darker, h1, dedicated canvas"
    },
    {
      "name": "title",
      "when": "opens the deck — same dark-bookend chrome as divider"
    },
    {
      "name": "content",
      "when": "the body slides that follow a subtopic"
    }
  ],
  "variantDocs": {
    "numbered": {
      "label": "Numbered — auto-incrementing module index",
      "caption": "Stamps an auto-incrementing module number. Each subtopic carries an independent counter from divider's section counter, so \"Section 02 · Module 04\" makes sense.",
      "sample": "<!-- _class: subtopic numbered -->\n\n`Module 04`\n\n## Then the next sub-topic, numbered automatically.\n"
    }
  }
}
