{
  "$schema": "../../manifest.schema.json",
  "name": "principles",
  "function": "inventory",
  "form": "stack",
  "substance": "structure",
  "description": "Declared statements — short stated principles, each with a one-line justification.",
  "purpose": "Use for design tenets, working agreements, or guiding rules. Each principle reads as a complete sentence; the justification is below.",
  "variants": [
    "numbered",
    "lettered",
    "roman",
    "bullet"
  ],
  "slots": {
    "title": {
      "selector": "h2",
      "required": true,
      "description": "Slide heading."
    },
    "principles": {
      "selector": "ul > li",
      "required": true,
      "description": "One li per principle. Lead each with **The principle.** then a justification sentence."
    }
  },
  "skeleton": "<!-- _class: principles -->\n\n## How we make calls when the spec is silent.\n\n- **Bias to action.** Default to shipping a defensible answer over chasing a perfect one.\n- **Decisions over options.** Document the choice, not the menu we evaluated.\n- **Cheaper to reverse than to debate.** Reversible calls don't need a meeting.\n",
  "anatomyBlock": "principles",
  "sample": "<!-- _class: principles -->\n\n## How we make calls when the spec is silent.\n\n- **Default to the cheaper-to-reverse choice.** Reversible calls don't need a meeting; only the irreversible ones do.\n- **Name the actor, never the system.** \"The PM decides\" lands; \"the process decides\" hides accountability.\n- **Write down the bet on the same slide as the choice.** The decision and its predicted outcome live together — the calibration loop depends on it.\n- **Form follows function.** Let the audience's need shape the layout, not the other way around.\n- **One main idea per slide.** If you can't summarise it in one sentence, split it across two slides.\n",
  "whenToUse": [
    {
      "title": "Working agreements",
      "body": "Team tenets, design principles, decision rules. Use when the slide's job is to declare how the room makes calls, not to show data."
    },
    {
      "title": "Stated as commands",
      "body": "Each principle is a short imperative sentence — \"Default to X\", \"Name the actor\". Statements with hedging language lose the principle's bite."
    },
    {
      "title": "Three to six items",
      "body": "More than six principles and the audience stops remembering them. If you have more, prioritize: the principles slide carries the load-bearing few."
    }
  ],
  "antiPatterns": [
    {
      "title": "Aspirations, not principles",
      "body": "\"Be empathetic\" is a value, not a principle. Principles are decision rules — they say what to do when two options conflict. Reach for content if it's a values statement."
    },
    {
      "title": "Long per-principle prose",
      "body": "Each justification is one sentence. If a principle needs a paragraph of context, give it its own slide and let principles act as the index."
    },
    {
      "title": "Hedged statements",
      "body": "\"We try to default to X\" reads as a wish. Drop the hedge — principles are declared, not negotiated. \"Default to X\" lands harder."
    }
  ],
  "related": [
    {
      "name": "actors",
      "when": "rules attach to named owners, not shared tenets"
    },
    {
      "name": "tldr",
      "when": "single-line takeaways without justification body"
    },
    {
      "name": "list",
      "when": "items are short bullets without title + body shape"
    },
    {
      "name": "cards-stack",
      "when": "each principle needs two sentences of body"
    }
  ],
  "variantDocs": {
    "numbered": {
      "label": "Numbered principles",
      "caption": "Authored as `ol` (`1.` source). Useful when the principles are ordered by priority — the first principle wins when two conflict.",
      "sample": "<!-- _class: principles -->\n\n## How we resolve conflicts — top wins.\n\n1. **Default to the choice that is cheaper to reverse.** Reversibility beats every other tie-breaker.\n2. **Name the actor, never the system.** Anonymous accountability is no accountability.\n3. **Write down the bet on the same slide as the choice.** Calibration depends on it.\n4. **Form follows function.** Let audience need shape the layout.\n5. **One main idea per slide.** If you can't summarise it, split it.\n"
    },
    "lettered": {
      "label": "Lettered",
      "caption": "Swaps the decimal counter for an A. / B. / C. letter sequence. Authored as an ordered list. Use when the principles are referenced by letter elsewhere in the deck.",
      "sample": "<!-- _class: principles lettered -->\n\n## How we make calls when the spec is silent.\n\n1. **Default to the cheaper-to-reverse choice.** Reversible calls don't need a meeting; only the irreversible ones do.\n2. **Name the actor, never the system.** \"The PM decides\" lands; \"the process decides\" hides accountability.\n3. **Write the bet on the same slide as the choice.** The decision and its predicted outcome live together.\n4. **Form follows function.** Let the audience's need shape the layout, not the other way around.\n5. **One main idea per slide.** If you can't summarise it in one sentence, split it across two.\n"
    },
    "roman": {
      "label": "Roman",
      "caption": "Numbers the principles with Roman numerals (I, II, III). Authored as an ordered list. Reads as a more formal canon — house rules, doctrine, a charter.",
      "sample": "<!-- _class: principles roman -->\n\n## The editorial canon.\n\n1. **Plain words beat clever ones.** If a board member needs a glossary, the slide failed.\n2. **One claim per sentence.** Compound claims hide the one a reader would dispute.\n3. **Show the number, then the verdict.** Evidence first earns the conclusion that follows.\n4. **Cut the adverb, keep the verb.** \"Grew sharply\" is weaker than \"doubled.\"\n5. **End on the decision, not the summary.** The last slide should ask for something.\n"
    },
    "bullet": {
      "label": "Bullet",
      "caption": "Replaces the numeric counter with a plain bullet. Authored as an ordered list (the counter glyph is swapped in CSS). Use when the principles are a set with no rank or sequence.",
      "sample": "<!-- _class: principles bullet -->\n\n## What we optimise for, in no particular order.\n\n1. **Reversibility over consensus.** Make the cheap-to-undo call now; reserve the meeting for the one-way doors.\n2. **Clarity over completeness.** A slide that says one true thing beats one that says five hedged ones.\n3. **Ownership over process.** Name the person; processes don't get paged.\n4. **Evidence over instinct.** Write the prediction down so the instinct can be scored later.\n"
    }
  }
}
